{
  "schema_version": 2,
  "name": "nvme",
  "version": "0.0-fixture",
  "description": "Synthetic fixture for the completion generator tests.",
  "commands": [
    {
      "name": "zulu-cmd",
      "device": "required",
      "alias": "alpha-alias",
      "description": "zulu builtin command",
      "options": [
        {
          "long": "mode",
          "short": "m",
          "argument": "required",
          "type": "enum",
          "metavar": "MODE",
          "description": "operating mode",
          "values": ["fast", "slow"]
        },
        {
          "long": "force",
          "short": "x",
          "argument": "none",
          "type": "flag",
          "description": "don't    prompt for 'confirmation'"
        },
        {
          "long": "format",
          "short": "o",
          "argument": "required",
          "type": "string",
          "metavar": "FMT",
          "description": "output format",
          "global": true,
          "values": ["raw", "pretty", "wide"]
        },
        {
          "long": "secret",
          "argument": "none",
          "type": "flag",
          "hidden": true,
          "description": "undocumented, hidden from help"
        },
        {
          "long": "verbose-level",
          "argument": "optional",
          "type": "string",
          "description": "verbosity level"
        }
      ]
    },
    {
      "name": "no-opt-cmd",
      "device": "required",
      "description": "builtin command with no options",
      "options": []
    },
    {
      "name": "alpha-cmd",
      "device": "optional",
      "description": "alpha builtin command",
      "options": [
        {
          "long": "wait-time",
          "short": "w",
          "argument": "required",
          "type": "u32",
          "metavar": "NUM",
          "description": "milliseconds to wait"
        },
        {
          "long": "format",
          "short": "o",
          "argument": "required",
          "type": "string",
          "metavar": "FMT",
          "description": "output format",
          "global": true,
          "values": ["raw", "pretty", "wide"]
        },
        {
          "long": "in-file",
          "short": "f",
          "argument": "required",
          "type": "file",
          "metavar": "FILE",
          "description": "input file path"
        },
        {
          "long": "format-version",
          "argument": "required",
          "type": "u32",
          "range": {"min": 1, "max": 2},
          "metavar": "VER",
          "description": "metadata format version",
          "global": true
        },
        {
          "long": "dry-run",
          "argument": "none",
          "type": "flag",
          "description": "print actions without running them"
        }
      ]
    }
  ],
  "plugins": [
    {
      "name": "zeta-plug",
      "description": "zeta plugin",
      "commands": [
        {
          "name": "report",
          "device": "required",
          "alias": "rpt",
          "description": "report a thing",
          "options": [
            {
              "long": "out-dir",
              "argument": "required",
              "type": "directory",
              "metavar": "PATH",
              "description": "output directory"
            },
            {
              "long": "format",
              "short": "o",
              "argument": "required",
              "type": "string",
              "metavar": "FMT",
              "description": "output format",
              "global": true,
              "values": ["raw", "pretty", "wide"]
            },
            {
              "long": "sel",
              "short": "S",
              "argument": "required",
              "type": "u8",
              "range": {"min": 0, "max": 3},
              "metavar": "SEL",
              "description": "selection source",
              "values": ["current", "saved"]
            },
            {
              "long": "in-file",
              "short": "f",
              "argument": "required",
              "type": "file",
              "metavar": "FILE",
              "description": "input file path"
            },
            {
              "long": "kinds",
              "short": "k",
              "argument": "required",
              "type": "enum-list",
              "metavar": "NAME,...",
              "description": "kinds to report",
              "values": ["red", "green", "blue"]
            }
          ]
        },
        {
          "name": "no-opt-sub",
          "device": "required",
          "description": "sub-command with no options",
          "options": []
        }
      ]
    },
    {
      "name": "beta-plug",
      "description": "beta plugin",
      "commands": [
        {
          "name": "local-sub",
          "device": "none",
          "description": "sub-command with local options but no globals",
          "options": [
            {
              "long": "mode",
              "short": "m",
              "argument": "required",
              "type": "enum",
              "metavar": "MODE",
              "description": "operating mode",
              "values": ["fast", "slow"]
            },
            {
              "long": "secret",
              "argument": "none",
              "type": "flag",
              "hidden": true,
              "description": "undocumented, hidden from help"
            }
          ]
        }
      ]
    }
  ]
}
